{
  "$schema": "../../../schemas/hooks.schema.json",
  "version": "2.0.0",
  "plugin": "home-assistant-architect",
  "description": "Scoped event-driven hooks for Home Assistant and Ollama workflows",
  "hooks": {
    "UserPromptSubmit": [
      {
        "matcher": "",
        "hooks": [
          {
            "type": "command",
            "command": "${CLAUDE_PLUGIN_ROOT}/hooks/scripts/ha-context-guard.sh prompt",
            "timeout": 10
          }
        ]
      }
    ],
    "PreToolUse": [
      {
        "matcher": "Write|Edit|MultiEdit",
        "hooks": [
          {
            "type": "command",
            "command": "${CLAUDE_PLUGIN_ROOT}/hooks/scripts/validate-yaml.sh",
            "timeout": 10
          }
        ]
      },
      {
        "matcher": "Bash",
        "hooks": [
          {
            "type": "command",
            "command": "${CLAUDE_PLUGIN_ROOT}/hooks/scripts/security-scan.sh",
            "timeout": 10
          }
        ]
      }
    ],
    "PostToolUse": [
      {
        "matcher": "Bash",
        "hooks": [
          {
            "type": "command",
            "command": "${CLAUDE_PLUGIN_ROOT}/hooks/scripts/ha-health-check.sh",
            "timeout": 10
          },
          {
            "type": "command",
            "command": "${CLAUDE_PLUGIN_ROOT}/hooks/scripts/ollama-status.sh",
            "timeout": 10
          }
        ]
      },
      {
        "matcher": "Write|Edit|MultiEdit",
        "hooks": [
          {
            "type": "command",
            "command": "${CLAUDE_PLUGIN_ROOT}/hooks/scripts/security-scan.sh",
            "timeout": 10
          }
        ]
      }
    ],
    "TaskCompleted": [
      {
        "matcher": "",
        "hooks": [
          {
            "type": "command",
            "command": "${CLAUDE_PLUGIN_ROOT}/hooks/scripts/ha-health-check.sh",
            "timeout": 10
          }
        ]
      }
    ],
    "Stop": [
      {
        "matcher": "",
        "hooks": [
          {
            "type": "command",
            "command": "${CLAUDE_PLUGIN_ROOT}/hooks/scripts/ha-context-guard.sh stop",
            "timeout": 10
          }
        ]
      }
    ]
  },
  "settings": {},
  "metadata": {
    "scripts_dir": "scripts",
    "log_level": "info"
  }
}
