{
  "$schema": "../../../schemas/hooks.schema.json",
  "version": "2.0.0",
  "plugin": "jira-orchestrator",
  "description": "Jira Orchestrator Plugin Hooks - Automated workflow triggers for Jira integration",
  "hooks": {
    "UserPromptSubmit": [
      {
        "matcher": "",
        "hooks": [
          {
            "type": "command",
            "command": "${CLAUDE_PLUGIN_ROOT}/hooks/scripts/detect-jira-issue.sh",
            "timeout": 5
          }
        ]
      }
    ],
    "PreToolUse": [
      {
        "matcher": "Bash",
        "hooks": [
          {
            "type": "command",
            "command": "${CLAUDE_PLUGIN_ROOT}/hooks/scripts/review-gate.sh",
            "timeout": 10
          },
          {
            "type": "command",
            "command": "${CLAUDE_PLUGIN_ROOT}/hooks/scripts/pr-size-guard.sh main",
            "timeout": 10
          }
        ]
      },
      {
        "matcher": "",
        "hooks": [
          {
            "type": "command",
            "command": "${CLAUDE_PLUGIN_ROOT}/hooks/scripts/jira-readiness-gate.sh",
            "timeout": 10
          }
        ]
      },
      {
        "matcher": "",
        "hooks": [
          {
            "type": "command",
            "command": "${CLAUDE_PLUGIN_ROOT}/hooks/scripts/merge-evidence-gate.sh",
            "timeout": 10
          }
        ]
      }
    ],
    "PostToolUse": [
      {
        "matcher": "",
        "hooks": [
          {
            "type": "command",
            "command": "${CLAUDE_PLUGIN_ROOT}/hooks/scripts/triage-trigger.sh",
            "timeout": 5
          }
        ]
      },
      {
        "matcher": "",
        "hooks": [
          {
            "type": "command",
            "command": "${CLAUDE_PLUGIN_ROOT}/hooks/scripts/pr-jira-transition.sh",
            "timeout": 10
          }
        ]
      }
    ],
    "Stop": [
      {
        "matcher": "",
        "hooks": [
          {
            "type": "command",
            "command": "${CLAUDE_PLUGIN_ROOT}/hooks/scripts/docs-reminder.sh",
            "timeout": 5
          }
        ]
      }
    ],
    "SessionStart": [
      {
        "matcher": "",
        "hooks": [
          {
            "type": "command",
            "command": "${CLAUDE_PLUGIN_ROOT}/hooks/scripts/session-resume.sh",
            "timeout": 5
          }
        ]
      }
    ],
    "SubagentStop": [
      {
        "matcher": "",
        "hooks": [
          {
            "type": "command",
            "command": "${CLAUDE_PLUGIN_ROOT}/hooks/scripts/capture-agent-telemetry.sh",
            "timeout": 5
          }
        ]
      }
    ],
    "PostToolUseFailure": [
      {
        "matcher": "",
        "hooks": [
          {
            "type": "command",
            "command": "${CLAUDE_PLUGIN_ROOT}/hooks/scripts/lessons-capture.sh",
            "timeout": 5
          }
        ]
      }
    ]
  },
  "settings": {}
}
