{
  "$schema": "../../../schemas/hooks.schema.json",
  "version": "2.0.0",
  "plugin": "github-orchestrator",
  "description": "GitHub Orchestrator lifecycle hooks — write guardrails, PR size budget enforcement, PR context detection, and agent/failure telemetry.",
  "hooks": {
    "UserPromptSubmit": [
      {
        "matcher": "",
        "hooks": [
          {
            "type": "command",
            "command": "${CLAUDE_PLUGIN_ROOT}/hooks/scripts/detect-pr-context.sh",
            "timeout": 5
          }
        ]
      }
    ],
    "PreToolUse": [
      {
        "matcher": "Bash",
        "hooks": [
          {
            "type": "command",
            "command": "${CLAUDE_PLUGIN_ROOT}/hooks/scripts/guard-github-writes.sh",
            "timeout": 10
          },
          {
            "type": "command",
            "command": "${CLAUDE_PLUGIN_ROOT}/hooks/scripts/pr-size-guard.sh",
            "timeout": 10
          }
        ]
      },
      {
        "matcher": "mcp__github__.*",
        "hooks": [
          {
            "type": "command",
            "command": "${CLAUDE_PLUGIN_ROOT}/hooks/scripts/guard-github-writes.sh",
            "timeout": 10
          }
        ]
      }
    ],
    "SubagentStop": [
      {
        "matcher": "",
        "hooks": [
          {
            "type": "command",
            "command": "${CLAUDE_PLUGIN_ROOT}/hooks/scripts/capture-agent-telemetry.sh",
            "timeout": 10
          }
        ]
      }
    ],
    "PostToolUseFailure": [
      {
        "matcher": "",
        "hooks": [
          {
            "type": "command",
            "command": "${CLAUDE_PLUGIN_ROOT}/hooks/scripts/lessons-capture.sh",
            "timeout": 10
          }
        ]
      }
    ]
  }
}
